{
  "dossier_id": "D-PILOTE-RES-002",
  "step": "comps-market",
  "artifact": "justifications_comparables.json",
  "justifications": [
    {
      "comparable_id": "CP-101",
      "source_id": "SRC-VENTE-101",
      "decision": "retenu",
      "raison": "source presente"
    },
    {
      "comparable_id": "CP-102",
      "source_id": "SRC-VENTE-102",
      "decision": "retenu",
      "raison": "source presente"
    }
  ],
  "source_fixture": "case_pilote_confiance_limitee.json"
}